questionText,answerText
"I have family issues, and my dad was both violent and a cheater.","I can imagine how incredibly difficult this must be for you. Having past traumatic experiences creap up on you without warning can be very scary and stressful. You may be suffering from symptoms related to post-traumatic stress disorder. Getting evaluated by a professional would be a good step to take next. By seeking treatment and having a therapist who you trust and can connect with, you will gain the ability to think about your experiences without it significantly interfering with your daily functioning."
"I have family issues, and my dad was both violent and a cheater.","Hi New York, There's no way to keep your past from affecting your present and future, because it's a huge part of who we are. The GOOD news is, though, that the effect doesn't have to be negative. I'm met many people who have horrific pasts and it helps them know confidently, every day, what kind of person they want to be and what kind of world they want to live in, and it helps them make really great decisions. You can accept your past, integrate your traumas and move forward in a very different way.If you"
"Over the course of a few days, my wife was unsure about her feelings for me due to constant intimacy issues. After she thought things through, she came to the realization that she is no longer ""in love"" or attracted romantically to me. She instead has more","Hi Portland,This must feel like your world is turned upside down, for your wife to declare her confusion, followed closely by resignation, followed closely by a new ""friend"". I get how upsetting this is.If I was your therapist, I'd want to explore this a good deal, because there are several possibilities concerning what might be happening. Be careful not to jump to conclusions.Sometimes people have been slowly ""falling out of love"" for a long time, and often this is due to some (perhaps unnamed) unmet need "
"My daughter didn't see her biological father for the last three years. She doesnt want to see him because she remember really bad things from him such as domestic violence and child abuse. The visitation is with supervision, but she refuses to see him. Is ","Hi Dillon,I'm from Canada, so I don't know the laws in your state. It depends on that a good deal, perhaps.In my opinion, a child should never be forced into a situation where they feel unsafe, even if it is ""supervised"". If the child is old enough to make a strong statement about not wanting to see a parent, then this should be honoured.Unfortunately, the laws don't always uphold a parent's right to do what is best for their child. I recommend you see a lawyer, who will advise you about how to proceed with"
My partner seems to always get depressed over the fact that his kids have to see and go through the divorce process. Its especially when the mother of his kids keeps making him feel bad and using the kids as an excuse to get back at him. I feel like just t,"Hold on, Sanger! You know, I meet with a lot of people who are so sick of the crap that their ex puts them through in the divorce process that yes, they wonder if it's best to go back. I don't think so.If your ex is using the children to manipulate, or is generally controlling the separation process, that's confirmation that getting out was the right decision.Your partner feels powerless to change the current situation. Of course he does, because there are many things that are beyond his control (his ex's b"
"Whenever I run into a situation that makes me upset or angry, I tend to start cursing and badly offending the person I am confronting. I say mean things to let my anger out. Whenever people tell me stuff about my relationship (like starting rumors or sayin","Congratulations on making your way to Step One, self-observation and deciding to change a feature about how you understand and relate to others.There is extraordinary strength in being willing to notice your effect on others and consider what changes are possible.Start on the inside track of your own heart and mind. Once you're able to understand what is driving your emotions to the point where the only reasonable way of handling them is to curse and offend people, you'd have gotten a long way in knowing yo"
"I have family issues, and my dad was both violent and a cheater.","Sorry that your growing up years in the family were so unsafe and painful.Everyone has family legacy patterns of behavior and ways of handling emotions, handed down to them simply by living.All of what any child observes and how they are treated within their family context, creates their foundational expectations of others.The best way of releasing yourself form hurtful interaction patterns is by being aware of your own feelings and intuition within close relationships.If you have a similar sense of hurt or"
"My boyfriend recently got a kitty. I hate cats in general, and he knows it. It grosses me out and makes me very upset when he pets his cat. I want to throw out the cat. I feel very jealous.","Sorry for you and sorry for the cat because you're each in a tense position.What was the context of your boyfriend adopting a cat since he was aware that this would likely cause problems in the relationship with you?If you don't already know his answer, then find out. Doing so will tell you a lot about your boyfriend's expectations about you. Does he expect you to accept without question, whatever he does? Does he care about your views? Does a cat have some deep meaning for him that having one is essential "
"My daughter didn't see her biological father for the last three years. She doesnt want to see him because she remember really bad things from him such as domestic violence and child abuse. The visitation is with supervision, but she refuses to see him. Is ","Has the father or the visitation supervisor contacted you regarding why your daughter hasn't shown up for the past three years' worth of supervised visitation?Or is the supervised visitation a new development for the bio dad and your daughter?If no one is pressuring or expecting your daughter to show up, no one has even asked where she is, why she isn't present, then I don't see any reason for you to offer more effort by your daughter, than the father is willing to make for seeing her.If your daughter is wi"
"Whenever I run into a situation that makes me upset or angry, I tend to start cursing and badly offending the person I am confronting. I say mean things to let my anger out. Whenever people tell me stuff about my relationship (like starting rumors or sayin","Hi California,I'm happy to hear you want to get a hold of this problem. Relationships don't tend to last when we treat people poorly. It is very possible for you to learn different ways of relating, with some strong effort. I would highly suggest working with a therapist, and I will give you a few things to think about in the interim.Sometimes anger is there because we feel something is unjust or unfair, but many times, anger is a ""secondary emotion"", and it's simply there to protect us from other, more vul"
My son stole my debit card and lied about it. It's not the first time he has lied. I don't know what to do anymore. I don't know if I should punish him or make him do something. I've tried talking to him and asking if anything was wrong. I have grounded hi,"Hi Enid, You sound like a sensitive parent; I like that you talked to your son to see if anything is wrong. There is some key information here (I don't know your son's age, whether he spent any money, whether he put the card back, or how many times he's stolen), and my answer might be different depending on those details, but I'll give you my thoughts.I see it as every child's job to figure out the rules and find where their power is in the world. In order to accomplish that, many of them test limits. ""What"
"I was hanging out with my close guy friend. We started kissing, but afterwards, he said that we should just stay friends because he doesn't want to ruin anything. We both just got out of relationships. His was very sexual. I'm not a sexual person, and he k","Given that both you and your friend recently ended your respective romantic relationships, kissing each other sounds like each of you satisfied a very natural need which for right now does not has a natural source of satisfaction.Suddenly being without a partner is difficult because a relationship absorbs and offers much of a person's energy.Stay focused on what you know about yourself, which is that you're not ready for another relationship.From what you describe about your friend, similar to you, he does "
"It's been almost a year since my ex-boyfriend broke up with me after he cheated on me many times. I had found out about a month before, but I hadn't told him I knew because I didn't want us to break up. I used to have very low self-esteem, and I think it m","The dilemmas you present are giving you a great chance to understand your true reasons for being in a relationship.Continue developing some points you've written here.That you grew up sensing and/or witnessing your mom's emotional pain from your dad cheating on her, very likely set a standard in your inner self, to expect similar circumstances in your relationship life.This is a natural dynamic which happens for all of us. What we observe in our growing up households is what we understand as ""normal"", no ma"
"I just had a newborn. When I brought him home, my mom told me to leave. Now I'm in a women's home. I don't see my boyfriend that often because he works. The women's place is helping me find an apartment so I can go back to work and get child care.","Congrats on the birth of your son!Was your mom's request for you to leave her house, one which she asked awhile ago or was this her greeting when you walked in the door?My question is whether your mom had some changed circumstance in her life, whether she and you discussed living arrangements prior to your son's birth, or whether nothing was talked about, you assumed you'd be living with her, she assumed you wouldn't, and the two of you didn't speak to one another about any of this.Depending on the answers,"
"I have been married for 20 years. He and I both cheated. I hid my cheating for 14 years. Over that time, I let life stress me out. I became depressed. When I finally woke up, he felt I had pushed him out.","Do you both want to fix the marriage?The relationship belongs to both of you so that one working without the other cooperating in this work too, will have one person who does all the changing.This dynamic itself creates problems of its own.About your husband telling you he feels pushed out, did he do anything on his own to address his problem of feeling like this?All you state is that he blames you for creating a situation he didn't like.If he did nothing because he felt unsure what to do, anything which sh"
"My ex-boyfriend boyfriend and I lived together. He had a two year affair with a girl and had three pregnancies with her. One was an abortion, another was a miscarriage, and then she had the third baby. They are not together, but he continues to contact me ","Hi Attica,This is a question I think a lot of people deal with...they feel confusion about why they can't forget about or get over (or stop connecting with) someone who they absolutely know isn't good for them.In your case, part of the problem is that he keeps trying to get back in touch with you. For some people, honestly, it's a game... to see how much power they have over you or it's their need to control you. If you don't want contact from this person, it's really important to give him clear messages ab"
"I was never like this. Recently this year (my first year of high school), I started getting emotional for no reason.","Hello Vancouver, It's really common for people to become very upset over small things sometimes. The small thing is a ""trigger"", and the emotions aren't so much about that event that's happening in the present; they are more connected to old events that evoked the same feeling. You've likely had too much of that feeling in your life and you've developed a sensitivity to it. Look at the small events that are triggers for you and ask yourself what same or similar emotion they evoke. If there's anger there, lo"
"I have a really bad temper. I get mad very easily then stay like that the whole day. I don't mean to be that way, but I can't help it.","A lot of times the anger someone expresses is from feeling a deep level hurt within themselves. A surface situation, like, a store told you they'd have delivery of a certain item by Tuesday, and when that particular Tuesday comes, the store doesn't have what they told you they would, and you are furious.The fury may have more with many times before in your life, having been deeply let down by someone who mattered to your life at the time, who similarly promised something and failed to deliver whatever it.If"
"About a month ago, I went through my boyfriends phone and found him messaging his ex-girlfriend that he was dating before me. He gave her a promise ring when they were together, and he still had it hiding in his memory box in our sons room. I found many th","Your sense of hurt is very understandable.Do you and your boyfriend have an agreement on looking through each other's phones?I ask because the overall problem sounds like lack of trust and that there may be a difference in what each of you wants and expects from your relationship.Probably if the two of you talk about these topics and you each become clear as to the commitment status of each of you to the other, you'll have more clarity as to what either of you would like from the other.With this new level o"
"I noticed lately that I've been thinking a lot about death. I don't want to die, and I'm not suicidal. I just think about what would happen if I died or if someone I loved died. I imagine how sad everyone I know would be. I know it isn't worth it, and I de","I'll respond to your speculation that if you let go of the steering wheel while driving, you'll end up quite seriously hurt, at the very least. It is fine to play in your mind with ""what ifs"". People who write horror movie scripts most likely have some terrible sounding stories and suppositions.If you trust yourself to actually not follow through with an idea that may kill you, and you recognize the difference between thinking dangerous things and doing dangerous things, then go to the next step of understa"
"I've been experiencing a lot of anxiety and panic attacks lately. I was recently diagnosed by my psychiatrist with obsessive-compulsive disorder. Lately, I've been questioning everything from my career to my relationship. My boyfriend and I just moved in a","Hi New Jersey,You talk about two very big changes in your life that have happened lately; the diagnosis/anxiety, and the moving in together. That's a lot!I love how you recognise that you been 'questioning everything'. I think anxiety's got its toe in the door and it's pushing you around, wanting some power over you. Fear and anxiety try to convince us that we need protection and that it's best to either pull away or fight. But letting anxiety control how you see your relationship isn't the answer here. I t"
"My husband and I have been together for seven years now. I will be honest: I have a problem lying to him about stupid stuff. I recently stupidly lied to my husband about an accident because I was afraid to tell him what happened. Ever since then, he gives ","Hi Texas, Thanks for your honesty; it helps me know where to go in answering you. What strikes me in your question is that you describe several ways in which your husband is hurtful/abusive/controlling with you, and then you ask ""Should we call it quits?"". We? I wonder if maybe the first step is for you to start seeing this decision as yours, rather than yours together.The way your husband treats you is not your fault, Texas. Your lies are a natural and normal way of you avoiding situations and encounters t"
"I'm depressed. I have been for years. I hide it from everyone because I'm scared of the reactions I'll get. Last time I tried telling my parents, it was a huge argument about me being too young to be depressed (Im a legal adult), calling me ungrateful, and","Hi Georgia, There's a really good lesson here. People tell us things, and we tend to think that's the truth...but it's not! I'll do some translating for you...""You're so ungrateful"" means ""I need you to be successful and happy in order for me to feel I'm a good parent"".""You're too young to be depressed"" means ""I don't want to deal with your mental health issues right now. I'll pretend it's not happening so I don't have to face my fear and shame"".""It's only going to get worse"" just means ""I don't know how to"
"I was texting a guy who wasn't my boyfriend, and my boyfriend found out. We work together, so he went to work and told everyone I was cheating on him. I moved out of the house. There have been previous problems, and I feel like I'm usually the issue here. ","Hi Dallas,While I think it's healthy for both members of a couple to have things that they need from each other and to talk about that, your situation sounds one-sided and rigid. Will you have a list too? There are elements of control here: humiliating you in front of coworkers, saying you have to sign the contract before you can move forward...does he decide when you move in and out? Your passive aggressive communications with the other man and your difficulty in knowing what direction you want also hint t"
I am on my own with my daughter. I am so worried and stressed about her.,"Your instinct to help your daughter, is natural.How you proceed depends a lot on whether she recognizes she has a psychological and emotional problem, or if only you see this from observing her.Also, her age matters a lot in what way would be most likely to succeed in addressing the problems you describe.If you and your daughter have different opinions as to whether or not she has problems, and she is above the legal age of when you have authority over her life, then you can only suggest to her that therapy"
"I don't know how to have emotions. I never had any from my birth. Being human, I think of myself as a monster. I enjoy pain. I cut myself for my climax during sex. I think most of the time, I lie, even when sometimes it would have been easy just to tell th","I'm not sure that you don't feel emotion or that you are frightened of the depth of your emotions.From what you write, the context of your growing up years had people telling you to not feel. Little kids and babies don't remember whether or not they had emotions since birth. This is information someone told you or was part of your family system.Possibly your family was afraid of their emotions or of you knowing yours.Similarly, your comparison of being human means being monster like, is not an obvious conne"
"I've been experiencing a lot of anxiety and panic attacks lately. I was recently diagnosed by my psychiatrist with obsessive-compulsive disorder. Lately, I've been questioning everything from my career to my relationship. My boyfriend and I just moved in a","How is your boyfriend responding to your discomfort around him?Has he told you that he's noticed changes in you?The good news about a relationship is that you can talk about matters with the other person. Doing so can only help clarify feelings and what either of you expect from the relationship. Given that the two of you recently moved in together, it is natural for new dynamics, feelings and expectations to arise. It just adds to the reasonableness of talking with each other about how living together feel"
My mother-in-law is mentally ill. She has been for most of her life. She cuts herself. She has been in and out of psychiatric hospitals for about 40 years. She has voices in her head that tell her to cut herself. She has had multiple shock therapy treatmen,"Hi Fontana,Thanks for providing all the details needed in order to respond to your question. It seems very clear to me that ""no"" would be the appropriate response. I like your healthy boundaries, and I'll help you explore possible ways to respond to her.First, she hasn't asked yet, and you don't know that she will. Right now, you can pleasantly ignore her hints. They're not hurting you and if you ignore them, they're more likely to go away. You can address and reduce your own anxiety about the possibility o"
"I have known her for years. She was dating my brother-in-law when we met. My kids think of her as their aunt. On Halloween 2014, I lost my mom to cancer. My mom and dad were still married when she passed away. My friend was there for me through that and my","How are you measuring whether or not your dad understands your wish?Your dad understanding your wish does not mean he will necessarily follow through with what you want.Based on what you describe about your relationship to the woman in question, your discomfort with the idea of your dad marrying your friend, is reasonable.Have the conversation with your dad that includes your viewpoint, and also ask him for his impression of your feelings.Its even possible he already has considered your feelings and hasn't "
"My wife and I have a great relationship except for our sex lives. We are pretty transparent and honest, and basically, she feels bad because she never wants to have sex. She doesn't have the desire. She's also never orgasmed. She feels like a terrible wife","Congrats on your upcoming baby!Its possible that the pregnancy is diminishing your wife's sex drive.From everything you describe about your wife, she sounds to not yet have become comfortable with having a wish for sex.The other side of the sex equation is you and your relative ease with having sex and whether it is for physical release or as an expression of love, some of each.Since you talk with each other honestly then start with a dialogue about what you each would like from sex with each other, from pe"
I've recently thought that i could be transgender but I've never had the mind of a girl.,"Hello Frostproof,Thinking about becoming transgender and being transgender are slightly different. This is a topic that is best discussed with a therapist that specializes in LGBTQ issues. From what you have written it sounds as if you still have some confusion as to where you fit in with the ""labeling system"". While labels provide a means to quickly identify and classify, they can also feel restrictive or confining. Instead of focusing on fitting into a specific classification, explore who you are as a per"
"I'm in my late 50s. I never loved or have been loved. I need deeper help than is offered in my small town, but I cannot leave this town because of agoraphobia. I find myself losing hope more and more. My brain barely works anymore, and my memory so small, ","Hi Oak Harbor,My heart goes out to you. Sometimes when I'm working with a client who experiences depression or anxiety, I ask them for a glimpse into their worst moments in their minds. ""What are the worst thoughts that run through your head?"". Often they struggle, perhaps out of shame; maybe they don't want me to know their worst thoughts. But I can help them better if I do know, because then we have a place to work from. You are feeling hopeless and worthless, and your thoughts support these intense emoti"
"I have known her for years. She was dating my brother-in-law when we met. My kids think of her as their aunt. On Halloween 2014, I lost my mom to cancer. My mom and dad were still married when she passed away. My friend was there for me through that and my","Hi Lincoln,It can be very difficult for children who have lost a parent to then see their other parent moving forward with anyone, so I understand how this change is even more upsetting to you.And...your father and your friend have clearly established a friendship and fallen in love. Did you see this coming? I hope they didn't hide it from you. If they did, maybe this is the issue? It would be a legitimate one.But in the end, your father, and your friend, are adults who are free to fall in love with whomeve"
"My wife and I have a great relationship except for our sex lives. We are pretty transparent and honest, and basically, she feels bad because she never wants to have sex. She doesn't have the desire. She's also never orgasmed. She feels like a terrible wife","Hi Seattle,While it's normal in many relationships for there to be a difference in sex drives, I believe that your wife has a major barrier to having a healthy sexual relationship. I'd be curious about what it was like at the beginning for you both, but these things can change. Sometimes people with sexual barriers are very active for a period when they're young because they're trying to prove something or overcome a fear.Right now, you can both accept that there is a barrier and it's hers and she can explo"
"My boyfriend of five months expresses how much he cares for me and loves me, and I believe it. It has been one of the best relationships I have been in for a short period of time, but he has lied to me so much. Hell tell me that he'll stop lying, and while","New York, New York...it's not your boyfriend's lying that concerns me the most; it's the lies you tell yourself. Verbal expressions are easy, but it's walking the walk that's more important in the end. When someone shows you what they're capable of, you can believe them. He's capable of being manipulative and deceitful, and he even lies as he's telling you he'll stop lying.What you're doing is called denial; when you see evidence of something but you choose not to believe the evidence. He might love you wit"
