questionText,answerText
"I have been dealing with depression and anxiety for a number of years. I have been on medication, but lately my depression has felt worse. Can counseling help?",Thank you for asking this important question. I find that there are three steps to getting ready for treatment.Step one is expressing interest in wanting to receiving treatment for the outcome of positive behavioral change. Congratulations you did the first step! You are showing your readiness to start counseling by asking this question.Now the second step is to find a counselor who specializes in treating clients with Anxiety and Depression. The therapeutic orientations I have found to be helpful in treati
"I feel like I am not at a good state of mind. I'm very unsettled in my soul. I'm not happy with myself or the decisions I make, which makes me not happy with anyone else. I feel like a failure most of my days. I don't feel like I'm good at anything anymore","It seems like you may be experiencing depression symptoms, they could be the triggered by unexpected life changes, or building up throughout time.The important part is that you have identified them and wanting to change them. The first step is to establish a self-care routine that will help you to feel centered and motivated: go for walks, or make any physical activity that you enjoy ( be kind to yourself, anything helps at this point), eat balanced, add whole grains and fibers to your diet, make a point to"
"I have four children. One of them is in her 20s, and she cannot afford to go, nor can I pay for her. She went last year for two weeks by herself.","Of what do you feel you'd be guilty?Family vacations are not a basic human right to existence. They are fun, ideally. You're not violating a basic human right. You wrote that you don't have enough money to pay for her to come along.You may find yourself feeling more guilty toward yourself if you give more than you reasonably can afford to give.My suggestion is to tell your daughter your reason for not taking her along. Maybe this will open more dialogue between the two of you."
"I'm in my mid-twenties now, and my boyfriend of seven years and I want to start a life. My mother is 100% codependent on me and is extremely manipulative. She suffers from type 1 diabetes, which she uses to guilt me if I ever leave her. The problem is that","Focus more on your own life and less on the very heavy descriptors you wrote to describe your mom.All the words you wrote represent psychological conditions which are either lifelong or take a lot of motivation and effort to change.Since the only person who can change how your mom handles her life, is your mom, and you are the only one who can do the same for yourself, devote more energy and time to living your own life fully, despite the emotions you feel regarding her."
It's especially bad at night time. I am scared of sleeping alone.,"Being able to know you feel anxiety and write about it, is the first step to addressing and handling it!Generally, anxiety is deep fear of not being able to handle what comes up in life.Somehow the person was insufficiently nurtured and so felt insecure when very young.Usually the person had to fend on at least a psychological and emotional level for themselves before reaching an age when doing so would have been reasonable.Their inner feeling of overwhelmed from when very young, hasn't faced the reality th"
"I'm in college currently, so I am not a direct victim anymore. My father is very abusive with his words and actions, and my siblings are getting treated horribly.","Yes you can help! Emotional and verbal abuse can cause a negative impact in your family. It is important that you encourage your siblings to seek assistance with a therapist, and maybe help them find one, they should have school counselors available and if not our college counselor may help you to get referrals. Its also a good idea to talk to your mom about the issue and ask her if she would like help as well. If you are concerned about your siblings' safety, contact Family Protective Services in your stat"
"It was over 20 years ago, but the pain has resurfaced again now because I have started seeing her Facebook posts about how great her life is. I feel so angry. How can I handle this?","First thing that you must realize is that most people only post the ""best parts"" of their lives on Facebook, some people even go so far as to make their lives seem better or more interesting and post mostly false views of their life. Facebook is watered down, candied version of our life, you put on there only what you want people to see. The questions you should ask is ""How have I grown from this?"", Is my marriage currently in a good place? I really wish there was some form of magic that could be performed "
I have been having horrendous nightmares this whole month.,"Are you facing any type of overwhelming situation in your waking life?Dreams and nightmares are the non-logical ways in which we make emotional sense of what goes on in our everyday waking world.Besides having some type of relaxing bedtime routine to set a peaceful mood for your sleep, and avoiding viewing violent films and video games as entertainment, maybe even avoiding news stories which sometimes have similar themes of violence, the content of our dreams and nightmares is out of our direct control.Your"
"My husband took a job out of state for the next year and seems to be a different person. Before, he worked and slept, and on off days, he'd stay home because he didn't want to do anything else. Now he's going out with friends several nights a week while I'","My first concern is you: As you stated, you have been emotionally starving for the past five years. Please try to find time for you; to clarify your thoughts and feelings by writing, talking to a trusted friend or family member and perhaps seeing a therapist.What's really going on with your husband? Does he discuss in detail his sudden change?Can the two of you still talk? Do you want the same things? Before you go to couples counseling, I suggest that you get some support first to feel grounded within your"
It's really hard to not have negative feelings about friends who don't put any effort into nourishing our relationship.,"Interpersonal relationship (either positive or negatives) need to or more persons who give and receive: attention, dedication, time and communication. But what makes friendships special is that they last trough time, at least with those who we call our true friends, those who know us well and whom we have a special connectionand those from whom we disconnect at times, without fear of losing them.Consider what is that you are going trough yourself and with your relationship, talk to your friend about your co"
"My boyfriend of eight years and father of our two children is a truck driver. He is never home and only contributes to our family financially. There is no other support given. He comes home when able, sleeps, gives money, and leaves again. I can't get him ","After eight years and two childrens, people change. I suggest to talk to him about how you feel, let him know that although he is gone for a long time, his presence as a husband and father are required and important. Ask him if he will be willing to engage again and how he would like to do so. Many times when the dads are away, moms design a perfect routine and they feel like they will disturb it. Make alone time and family time for him, so you can reconnect as a couple and then as a family.Cmo trabajo con "
"My wife works late most days, so I'm lonely. I love my wife with all my heart, however I don't feel the intimacy we used to have. We don't have sex anymore, which bothers me tremendously. I have become close friends with a coworker, which I know is not hel","First things first! Friendships that develop in times of struggle may be a great emotional support, but also become confusing there's sexual attraction. And entertaining a tough is only going to make it a stronger target. Careful with that friendship! You do not want to fill your marriage's void with another person. Even when you are in a friend zone and not having intimacy with this person, you may be developing a special bond, sharing interest and activities that may lead to a deeper connection. Ask yours"
"My mother has Alzheimer's and she has become so nasty and mean to everyone and she always asks for unrealistic, silly or meaningless items. I get so frustrated and angry, but then I feel guilty because I know it probably isnt her fault. How can I cope with","Yes, certainly your mom's difficulty in having meaningful conversations with people results from the Alzheimer's disease process which weakens her brain function.Feeling a sense of guilt in relation to a parent, is pretty common for everyone.This is because as little kids and babies, we had a strong reliance on a parent and believing every word they sad and wishing to follow each action they ask or demand, was for the benefit of our own survival.One way of coping with your feeling of guilt is to examine it."
"My mother has Alzheimer's and I can see that she has lost some of her intellectual abilities. Even though I know this disease is not her fault, Im still finding it difficult to separate my own feelings of disappointment and frustration when my mom seems to","Good observation on your part, to distinguish that your feelings in relation to your mom are not necessarily connected to the way she handles her part of the relation toward you.Has your mom usually ignored your opinions and wishes in relating to you?If prior to the onset of Alzheimer's, she never examined her way of relating to you, and if both of you have never had an open conversation about your sense of feeling hurt by her attitudes and manner with you, then the relationship between you and your mom wil"
"I keep feeling paralyzed and unsure during interviews. Previous jobs have fired me for lack of performance, and five employers have rejected me after extensive personality tests and interviews. I'm afraid of continuing because my depression is getting wors","It sounds like you are feeling pretty overwhelmed and stuck between wanting to improve your work situation and worrying that you won't be able to. It is possible that the paralysis, uncertainty, and self-doubt that you describe are contributing to your difficulty in getting and maintaining a satisfying job as employers generally like to see that a potential employee is confident and can think on his or her feet. With a competent therapist, you may be able to get more understanding of the roots of these feel"
"I'm in my early 20s, and I've been seeing my boyfriend for a year now. My boyfriend has always been the sweetest guy until recently. He has made comments such as you would look better as a Tumblr girl"" or ""you should start doing more squats."" It's really h","Hello, and thank you for your question. I am very sorry that you are experiencing this. To be honest, this kind of behavior is really emotionally abusive, and you likely know that already. The unfortunate truth is, there is very little we canactuallydo to change another adult's behavior if they are not interested in changing it. Many people who behave in this way actually feel justified in saying what they say, or even believe that they are ""helping"" in some way by telling you how to improve yourself. What "
"We have been together over a year. We spend time together every day no matter how busy. He started to be unusually fatigued and losing weight. He also began to be distant and sexually selfish. We had a argument, and he confided he has late stage stomach ca","Hello, and thank you for your question. I am very sorry about this life-altering situation that both you and your boyfriend are going through. To be sure, this is a devastating and lonely road for both of you. I say lonely because when things like this happen we often don't know what to say to each other, and so we suffer in silence with little support.Here are a few thoughts that I am having, and perhaps others will add things, too:1. By the sound of your main question, it seems like you have every intenti"
"She's in her early 20s, and she has a toddler.","Well, first let's identify what factors are involved in the situation about which you wrote.Are you the only decision maker regarding your stepdaughter living with you?Is her dad, and your partner, living under the same roof?Would you feel any obligation to consult with your husband about his opinion and his way of handling the situation?Have you talked with your stepdaughter about your observation and your reaction to the fact of her not honoring your boundaries?Consider too that there will be an effect on"
Nothing we've tried has worked so far.,Probably what you should do is decide whether you can continue having a romantic and sexual relationship with someone to whom you don't feel like having sex.Five years is long enough to know that the way you feel toward your partner is more than likely going to remain this way.Talk with your gf about your feelings because she may not wish to be in a relationship in which her partner is not sexually attracted to her.
"Any time my family and friends are in an altercation, Im the one who steps in. Im the one they call to fight for them. I do this even though I have a tough time trusting the people Im fighting for. Im only in my early 20s.","Breaking the patterns of relating to family members, is difficult work.In the situation you describe, both you and the family members who ask for your intervention, will be affected by any change you decide to make in the way all of you handle family disagreements.Always, it is best for any two people who have a disagreement, to talk directly with each other. A third person distracts from the content and reasons for disagreeing.Maybe knowing that by pulling yourself away from mediating family arguments, you"
"I've only been married three months. Every week, we argue about something, and it seems to be getting worse.","At the begin g of marriages, we expect to be living on an eternal honeymoon, but the reality can be different. This is a process of adaptation, even if you had known your better half for a long time, during the first months and years of marriage you go through a process of settling in your new roles and confront new challenges together that as you resolve become new rules and agreements.Yes, you can work this issues by practicing assertive communication, being clear with each other about what is the problem"
"I was in a car accident and totaled my car. I gave up my job of nine years to pursue school full-time to better myself. I failed a class, and my boyfriend that I live with thinks Im stupid and wants to break up with me. I have nowhere to go, and I feel lik","When we feel overwhelmed by life situations, it is important to understand where the feeling is coming from. Once we understand the source, it is important to normalize the situations that got us there and find balance in our lives.First, car accidents are common, and since they are accidents they are not a reflection of us. When we have an accident we feel anxious, worried, and may have some trauma after the accidents. If you have been experiencing anxiety since the car accident, talk to your doctor or the"
"My dad is doing some really bad drugs, and I'm not allowed to see him anymore because of what he can do to me or my siblings on this drug. It has affected me tremendously in my life. Its even caused me anger and stress.","It seems like you are going trough stages of grief, since the inability to see your father causes you similar feelings as if you had lost him. Perhaps you could send him letters expressing your feelings and hopes. But do understand that if he is under the influence of drugs he might not be able to empathize with your feelings or react in the way that he would have done so in the past. As the issue evolves find a therapist or counselor to help you work on letting go of that anger and stress, which may affect"
My daughter is in later elementary school. She can't color in the lines. Her words jumble together when she writes unless there are big spaces or she skips lines.,"Depending on your daughters age, this could be a learning disability. I suggest contacting the school counselor and asking for an evaluation, once she is evaluated and depending on the diagnosis, she could be provided with treatment recommendations like occupational therapy, reading glasses, or assistance in class. These and more accommodations are enforced under the 504 act. Consider if the observations that you have done are affecting her performance in school only, or also in other settings. Observe her "
"In the last ten months, I've been kicked out, moved around three times, worked many jobs, stopped school to make money, had dad and mom get sick, was cheated on while pregnant, lost my baby, had relationship issues, and was betrayed. I can't get a job. I h","One thing that may help is to focus on small things that you do have control over. If you can hold onto that sense of having control over what you wear or what you choose to eat or where you go during the day, this may help you be able to look at what is currently most important for you and consider different choices. For example, you say you can't get a job, but I wonder if you could work with and local agencies to help you find a job, like Career Link. You say you have no friends currently. Are there any "
"My daughter basically freaked out out of nowhere over me saying calm down when she dropped her phone. Within seconds, the situation escalated to her kicking me out on the curb, saying horrifically unspeakable things, and her calling the cops on me. She see","Bipolar disorder has a lot of different components. If this is a one-time event, it could be that your daughter had an intense moment of anger and the phrase of asking her to ""calm down"" may have made her feel as though you weren't understanding what she was saying. Bipolar disorder also includes feelings of depression. When this is coupled with intense anger and acting or speaking without thinking, these can be part of bipolar disorder, but that wouldn't be the whole picture of what bipolar disorder would "
"I'm a teenager, and I created a sort of imaginary friend to help me cope with stressful situations or if I'm worried or upset. She ""gives me advice"" and comforts me and tells me it'll be okay. I've given her a name (Solace) and created a personality for he","Since you are saying that you know that the thoughts are yours and your thinking of them in a different person's voice to make them easier for you to follow through on, it doesn't sound like it could develop into another personality.It may be helpful to also find other things that give you comfort and to practice telling yourself that it will be okay in your own voice. If you start to do that slowly, it may be more comfortable for you. If you're following following through with your own advice, it sounds li"
"My ex-boyfriend and I have been back and forth for over a year now. He's in his late 20s, divorced for like five years now with two kids. He has a lot of narcissistic behaviors. He lies and cheats, but I love him. I've tried to date other people, but I alw","There are a lot of pieces to the decision of whether to stay or leave. Can you have open conversations about your concerns? Is he able to listen to that? I'm not sure how you know for sure that he lies and cheats, but does he recognize these things as problems? Which part of you is bigger: the part of you that wants to stay or the part of you that wants to leave? Can you consider what you want, wish for, and desire while also considering the same for him? Can he do that for you?"
"My mom and dad got divorced four years ago. I had to finish out the school year with my dad, and now they are deciding which place is best for me. I can't choose. How can I choose if I love both places?","I don't know how old you are, but depending on that, you may be able to talk with them about spending some time in both places. Even parents who live in different states can do that sometimes. It's not as frequent as spending one week at one house and the next week and the other, but I know that it happens.If you can talk with both of your parents about how you would like to live in both places, maybe you can all work out some kind of agreement."
"I've tried working out and eating fruits and vegetables, but I always seem to eat the junk in the house.","I know some people do better when they don't have as much junk food in the house. This is not as tempting then. Having said that, maybe you can reward yourself with different things, such as having dessert on certain days. If you are concerned about mostly eating habits, consider seeing a nutritionist. They can help you find the balance between what it is that you really want and your goals. I'm not sure how this links to happiness for you, but hopefully looking at your choices can lead you toward your goal"
I get really mad easily at my parents and family.,"Anger is not necessarily a bad thing. If you are angry and you can talk about your feelings, that would be very helpful. Anger usually comes along with something else, like feeling sad, worried, overwhelmed, confused, and many others. Consider looking at what you notice in addition to anger and you may have a different starting point. If you get along well with friends and don't get angry with them, look at the differences. Do you feel criticized by your parents or family? Misunderstood? There could be any "
My daughter is in later elementary school. She can't color in the lines. Her words jumble together when she writes unless there are big spaces or she skips lines.,"It's hard to tell from the information that you were able to provide here, but talk with her elementary school a guidance counselor. Someone working with the school (usually a school psychologist) should be able to evaluate her to see if she needs extra help and to tell you more clearly what may be happening."
"I'm dating a guy I really love. We have our problems, but I could see myself with him long term. But there's this other guy who I've had feelings for for awhile now. He gives me butterflies when we talk, and my heart beats fast when I see he's texted me, w","There are different types of attraction. You said that you've never felt this sort of feeling of your heart beating faster with your current boyfriend. Depending on how long you've been together and if you're looking at different ways of making a life together and getting to know each other on a deeper level, that's a different stage in a relationship and sometimes it feels different. Some people look at it as a difference between levels of passion and compassion, but there are many different terms to try t"
"I'm starting to think that I might have depression. The thing is though, I'm not exactly sad. I can joke with my friends and stuff, but I've stopped caring about my work, and I've been starting to think that life is pointless. I really have no clue if I ne","It is possible that you have depression, but you could also be experiencing some other changes that mean that you have feelings of being sad without actually being depressed. Your statement makes it sound like you've stopped caring about your work, but you're still going to work and doing your work. It almost sounds like you are dissatisfied with your work. Do you like what you do?When you said that life is pointless, what makes it that way? What is keeping you going? Is there something you can do each day "
"I used to be the funny guy of the groupthe class clown, if you will. I used to laugh uncontrollably all the time and be able to be social without it feeling awkward. Now I can't laugh at all, and I'm dead inside.","If you look back to when you feel as though you were the ""funny guy,"" I wonder what is different now? It may be that responsibilities have changed or any number of other things.I don't know whether you're also saying that you feel sad or if you're saying that you feel as though you don't have any big changes in your feelings.A lot of us tend to be really busy, and sometimes we over schedule ourselves to the point that we don't have time to have positive time for ourselves. Sometimes even if we are spending "
"I have friends, family, I live in a good home, I go to a nice high school, and I get pretty good grades, but I dont know why I'm so unhappy. These friends are my best friends and theyre all amazing people, and yet I'm sad all the time and feel alone.",I wonder if you have moments where you feel happy?You say you have amazing friends. I wonder if you get along with them and feel as though you can be yourself around them.Sometimes we put a lot of pressure on ourselves to do really well at everything all the time and this can be overwhelming sometimes. Where do you have support? I hope you can tell someone that you are feeling sad so that you can talk about your feelings.Sleeping can make a big difference as far as feeling sad as well. If you're not sleepin
"My fiance is always letting me know how I am a horrible/evil person, or I just dont care enough when its about her feeling or when she is having an off day.","One thing you could try is to have a conversation when neither of you is upset so that you learn what makes each of you feel cared for and valued. It could be that you are showing caring in a way that doesn't quite match what she is really looking for in that moment. For example, having an in-depth conversation could be something that you want, but she may just want a hug in that moment.I don't know if you heard of Gary Chapman's book about love languages, but it may be helpful."
