questionText,answerText
"My wife and mother are having tense disagreements. In the past, theyve had minor differences. For example, my wife would complain to me my mother is too overbearing; my mother would complain my wife is lazy. However, its intensified lately. I think the cau","What you are describing is something psychologists have termed ""triangulation"" which is what happens when one family member will not talk to the one they have a problem with and goes to a third member of the family to complain instead. You have been ""triangulated"" by your wife and mother.This is often seen in families. It's seen everywhere. How many times have you had a problem with someone but you didn't go to them to tell them, you went to someone else to complain? It is usually difficult for a person to "
"I'm planning to have baby, so I have to quit smoking - but it's hard. Sometimes it's not a physical need, it's mental. I cannot help myself from thinking about smoking. What can I do to get rid of this addiction?","Hi. Good for you in planning ahead to do what's healthiest for your baby (and yourself). That's a great first step! It's also good that you are able to identify that it's not always a physical need that's driving the addiction.For the next steps, I would suggest trying to figure out when the psychological cravings for a cigarette occur. The psychological (or mental) cravings are usually based out of habit, such as having a cigarette after a meal. And if you're consciously trying to quit, you'll find the cra"
"I have secrets in my mind, and I don't know what to do with them. I don't want to tell my wife and mom because I don't want to hurt them. But I'm not sure how long that I can keep the secret to myself. What should I do? It's becoming annoying and making me","It sounds like keeping the secrets has become a problem for you now. There are several things to consider before you make a decision.- You mentioned that you don't want your wife and mom to know because you don't want to hurt them why would it hurt them?- Is it necessary for them to know this information?- What are the consequences of either telling them the truth or not telling them? (for you and for your wife and mom).- Once you have considered these, think of what you would tell your friend if they were "
I am extremely possessive in my relationships and this is hurting my friendships. How can I fix my underlying issues?,"Hi there. It's great you are able to realize there are other issues going on with someone who feels possessive. At the root of it is fear. Fear of losing someone, fear of being alone, fear of not being good enough. All those fears can lead to low self-esteem and feeling like you have to control other people so you don't lose them. The thing is, controlling other people only pushes them away. Vicious circle, right?What I would suggest is some cognitive therapy to change those underlying ways of thinking. You"
I had a head injury a few years ago and my mind races all the time. I have trouble sleeping and have a lot of anxiety. Every medicine I have been on my body rejects; I get sick to my stomach and get blisters in my mouth. How can I calm my self down? I'm a ,"You didn't say what or how many medications you've tried. Certain anxiety medications can make you feel nauseous, but I haven't heard of any that cause mouth blisters, so there may be some other underlying medical issue there. I would definitely talk to your primary care physician and whoever has prescribed the medication as well as a neurologist if you've suffered a severe head injury. There are so many medications available for anxiety or insomnia or even depression that there may be others with lesser si"
I want a secure relationship with someone that wants to be with me and who will actually put effort into it. I seem to gravitate toward unavailable men and those that want intimacy and no relationship. I let men dictate and control me because they accuse m,"It is a good thing that you have recognized that you have been in some unhealthy relationships and that you are wanting to break this pattern. You seem to have some good insight into the situation.The type of behavior that you are describing is usually rooted in childhood issues with insecure attachment bonds with your caregivers, childhood trauma and/or abuse or neglect, or dysfunctional family issues that did not allow you to develop healthy boundaries for yourself or a sense of self. This is something th"
I easily recognize this but have no control over it and need suggestions for managing my anger.,I suggest that you work on emotional awareness.Emotional awareness basically means knowing what you are feeling and why.Emotional awareness also means that you can identify the link between the way you are feeling and your actions. In other words knowing that your feelings dictate what you do.Often feelings of hurt or insecurity can come out as anger if we cannot properly identify and express the feelings.Being emotionally aware also means that you are able to express your feelings to others. Being unable t
"It takes me a long time to fall asleep; Id estimate about two hours. I often have nightmares, starting with being eaten by a monster, and I often wake up frightened and unable to breathe. I believe I started losing sleep after breaking up with a girlfriend","First of all, exercise is always beneficial for your physical and emotional health. That's great that you have added this in your routine. Have you also considered altering your diet? Certain foods are linked with poor sleep. For example, alcohol, caffeine, nicotine and high fat content foods do not bode well with quality sleep, especially right before bed time.On the other hand, warm milk and foods high in carbohydrates have actually shown to positively impact sleep.Additionally, at bed time it's important"
What do you do when a therapist and a parent drugs a child and makes up lies in order to stop the other parent's custody visitation?,"I will admit I am confused about this question. Are you the other parent in question or a concerned coworker of this therapist?Therapists do not prescribe or have access to medication. Most therapists won't even get involved in a custody battle. They know there is a good chance of their records ending up in court and that they themselves will have to testify in court. Of course, therapists are human and can make mistakes, but I find it highly unlikely that a therapist would knowingly and willingly do someth"
They're calling me names like hypocrite and a baby even when they act in the same manner as I do. I'm tired of being called names. What should I do?,"It sounds like your confused as to why your friends would be calling you a hypocrite when they act in the same manner, correct? Communication is key to any relationship. I would recommend speaking with your friends face-to-face to address why they feel your behavior is concerning.In-person contact is the best method of sorting out differences considering texts, emails or any written response can be misconstrued. Be upfront with them and let them know that being accused of hypocrisy is hurtful and you feel i"
"Cheating is something unacceptable for me but because we have two daughters I decided not to break up the family. However, now I am struggling to forget and forgive what happened. I feel like I cannot trust him. Without trust, I cannot stay in this relatio","First of all, my heart goes out to you. Infidelity is an extremely challenging obstacle to overcome. There are some things that you should consider. First of all, did he seem truly remorseful? If you felt in his heart that he was truly sorry for what he had done, it will give you a piece of mind that it was a mistake.Secondly, was he forthcoming with this information? How about with answering your questions after the truth was uncovered? If you found that he was still lying or not forthcoming, the sting is "
"I have a lot of issues going on right now. First of all, I have a lot of trouble sleeping at times, while other nights I sleep too much and still feel quite tired. Im also noticing increased irritability and experiencing anxiety attacks that last for hours","It sounds as if you may be experiencing a bout of anxiety and/or depression. Sleeping difficulties, irritability and anxiety attacks all are correlated with these mood disorders. And its actually quite common for someone to deal encounter this during their lifetime.Also, keep in mind that just because you are experiencing this now does not mean that you will be dealing with it the rest of your life. Many times, it can be a single episode and if treatment is received, you can help prevent any recurrent episo"
"I have no sex drive due to medical issues. Ive shut down completely and closed everyone out. Ive even told my husband that I wanted a divorce since thats what I thought he wanted to hear. However, it devastated me when I learned he's seeing someone else. I","Im sorry to hear about your current situation. My heart goes out to you during this time.First of all, it is of vital importance that you discuss your symptoms with your doctor. Regardless of whether you are able to mend your relationship with your husband, you need to address the physical issues you are experiencing. More than likely he/she will be able to help you relieve some of these symptoms.Secondly, you must be upfront and honest with your husband. Intimacy is a large part of a relationship and it is"
"I have a lot of issues going on right now. First of all, I have a lot of trouble sleeping at times, while other nights I sleep too much and still feel quite tired. Im also noticing increased irritability and experiencing anxiety attacks that last for hours","Hi there. I have to commend you on reaching out to get some answers on why you are feeling the way that you are feeling. A lot of people secretly go about their lives every day feeling this way because they are too afraid of what the answer might be.First off, what stressors do you have in your life right now? Financial, relationship and unemployment are all common stressors for people. They can often make it difficult for us to sleep at night due to the constant racing thoughts and wonders of how you will "
"The last of my emotions belong to my pets. Today my dad said he might get rid of them tomorrow. If that does happen I might dig hole in the ground with a paper that says ""here lays my emotions. R.I.P."" I practically have no emotions left and I came to the ","It sounds to me like you have had a lot going on and now you are afraid you are going to lose the last things you care about, your pets. I do not know what all is going on in your family, and I cannot answer for your dads actions or his reasoning behind this.I would recommend that you focus on developing healthy coping skills. We cannot change what others do but we can change how what they do affects us. If you have all of your emotions and all of yourself tied up into one thing (like your pets) then when t"
Me and my girlfriend just broke up. She said she loves me but is not in love anymore. This came out of nowhere. We seemed so happy together. It all started when she went to Missouri to visit her family. The first week she was there she was fine then once s,"I am sorry to hear of these troubles. I see a few issues here. I wonder why you were both trying to get pregnant when the relationship seemed troubled? Some people think that they can fix a broken relationship by getting pregnant, and all this does is bring up more problems.You say you never treated her badly, and I believe you. People in a relationship can still be unhappy even when there is no abuse or mistreatment going on. In fact, giving too much of yourself to the relationship and not having a self ou"
Now I have anger and trust issues. How can I treat this and fix myself?,"I will assume that for whatever reason, you either do not want to or are not able to seek counseling for this. However, I highly urge you to do so because long-term childhood abuse does have negative consequences for your life as an adult, as it seems you are already aware.There are confidential and free crisis hotlines that you can call that deal with sexual abuse. Some/most also offer free counseling services in local areas. That would be a good place to start looking, especially if cost of counseling is "
I've never been able to talk with my parents. My parents are in their sixties while I am a teenager. I love both of them but not their personalities. I feel that they do not take me seriously whenever I talk about a serious event in my life. If my dad does,"Hi there. Being 15 years old can be a very difficult time in your teenage life. I remember when I was 15 and how I often felt my parents werent listening to me. Its even more difficult when you feel that you do not have a friend that you can confide in.Having depression in the past and being able to get through it shows me that you can get through anything! Depression alone is a very difficult problem to work through. In addition to the communication problem with your parents, it appears that you are also s"
"I have been with this guy on and off for 8 years. At first, we used to do things together and our sex life was ok. Then things started to change, we'd break up and reconnect, and he cheated on me numerous times. We've also had two beautiful baby girls duri","I don't think youve lost something, I think youve found something - your breaking point, and it's about time. Your boyfriend seems to be a very selfish and immature man who reconnects with you when it's convenient for him. Obviously, he has his own issues, but I want to address yours. I agree you need to talk to someone. The fact that youve put up with his repeated cheating and then letting him blame you for it (by saying you're not affectionate enough, etc.), tells me you probably have low self-esteem and "
"My son claims that hes been having extremely violent thoughts and dreams. Not violent like he's hurting someone, but violent thoughts like horrible things happening to his loved ones. He explained one of his dreams the other day and it was so violent it wa","Let me start my stating this is important to take seriously - taking to his PCP, getting a referral to a pediatric specialist, and getting him to a relational psychotherapist would be my first tasks.I wont label this occurrences as ""normal"" yet it is important to note these things do occur. My first observation is to say that it is a tremendous advantage that your son is communicating what he is experiencing. I'd encourage him to continue to do so, no matter the extent of his thoughts - his trust of you bei"
"Whenever I leave my girlfriend I get panic attacks. I'm taking medications to control them, but I'm thinking of moving in with her since I get so anxious.","Im sorry to hear that you are currently experiencing panic attacks. I hope that the medication you have been prescribed has provided you with some relief. Unfortunately, I dont feel that moving in with your girlfriend would alleviate your anxiety. Although you may feel very anxious about leaving her, your body is reacting to this stressful event in your life in an unhealthy manner. You may be able to render this particular situation but its likely that you may experience another panic attack when an additio"
I need to get on base to see my doctor. My ID card was in my wallet which was stolen. Im unable to reach my husband at this time. He is only one who can take me on base in order to get a new ID so I can continue to see doctor. Is there anything I can do?,"Do you have any other form of identification? The first place to stop would be the Visitors Center or whichever department issues passes. They are located outside of the gate so you do not need a military ID to enter. If you have another form of identification its possible that they can give you a pass in order to go and obtain a new military ID.If you do not, you could always ask someone else to sponsor you on (a friend, coworker, etc.) that have military access. Depending on the threat level, they may not"
"Ive known my boyfriend for several years. We were friends for a long time. In 2013 we started a relationship, and he even asked me to move in with him since I lived out of state. I planned to move in with him in 2014 after I finished school and he found a ","There are plenty of red flags that you have been presented with:Several breakupsNot holding up his end of the bargain regarding workLack of empathy for your miscarriageLying about his involvement with another womanPhysical violence, which is of most concern.This seems to be a very unhealthy relationship. In my experience, relationships such as these rarely become positive ones. Violence is never okay and regardless of his reasoning (you looking through his phone), it is indefensible. You have to look at the"
I am going through a divorce from a narcissistic sociopath who left me for another woman after mentally and emotionally abusing me for 11 years. I have moved to a different state and after giving up my successful business am working as a server at a restau,"I am very sorry to hear of your struggles. I think that it is normal to struggle to get your feet under you again after a divorce, especially after leaving a relationship that lasted 11 years, so try not to be too hard on yourself. Take it one day at a time and do the best you can.I notice that you said he left you. This tells me that you didnt have the strength to leave him on your own despite the fact that you say he was emotionally and mentally abusive and also cheating on you. Low self-esteem can keep s"
"I've been married for 3 years and I have two kids. During my 3-years married, my husband cheated on me twice. The second time really got to me and at my lowest I hurt him back. We aren't communicating as well as I would like. What do I do?","Hi there. Thank you reaching out for help. It takes a lot of courage for someone that is being abused to reach out for help. I want you to know that I am here to help you in any way that I can.First and foremost, you did not mention whether or not you had children yourself by this man. Im going to assume there are. So, the most important thing right at this moment is asking yourself, if you and your children are safe? Is the boyfriend currently living in the home or is he coming and going? If he is coming a"
I have been with my husband for almost 7 years. We got engaged a little after 5 years of being together. I had always been clear that I wanted to get married and I sadly would drop hints about how i wanted him to propose. When he did propose it was during ,"It's hard to let go of the dreams you had regarding your wedding and engagement. This was something that you and most women think about for years, so it's understandable to be disappointed. But please be aware that it is rare that any wedding is perfect. You may envy your friends' weddings but more than likely they had a few mishaps of their own and/or it wasn't as perfect as they had planned it either.However, like you know, the marriage is the most important thing. How many women are envious that you are "
What can I do to stop grieving my mothers death? When I am awake I just cry every day. I don't have anyone to talk to. I need help; I am still cry over her. Will I ever stop crying? Its been 3 years.,"I am sorry that you lost your mother. That is a really hard thing for someone to go through.There is really no set time for grief to be over, but I agree that if it has been three years and you are still crying every day then this is past the time for normal grief. I do not know how old you are and if you are in school or have a job, but I would imagine that if by now you literally were doing nothing but crying every day all day, someone would have noticed and would have gotten you some help. For one thing,"
I'm having issues with my relative. The police never believe the experiences I have been through because I am only a kid. I've even had trouble trying to reach a therapist because I said I wanted to get an adult to help me. Could you please give me advice?,"I think it would be wise for you to call a hotline especially designed for children. It's called the Childhelp National Child Abuse Hotline. The number is 1-800-4-A-CHILD (1-800-422-4453).It is completely anonymous and a trained therapist will be able to provide you with guidance, confidentiality, and can also help you make a report of you want.The call is completely free and they are open 24 hours a day / 7 days a week.I'm glad that you are taking steps to improve your situation. You are a very brave and a"
My wife just last week said she wants a divorce and it's all sudden. I understand that marriages have their ups and downs but I don't understand why she can't tell me why she wants a divorce. Should I fight for my family (daughter and wife)?,"Chances are, if you really think about it, there were signs that something wasnt quite right in your marriage. You may have passed these things off as being the normal ups and downs of a marriage, but whatever it was (or wasn't), it's obviously bothering your wife. I would say yes, keep trying to fight for your family, at least until you know what the problems are from your wife's perspective and if they're repairable. Ask your wife if shes willing to try to work on the marriage and then see a marriage coun"
I loved him more than anything. He passed away on our anniversary which was also the day I was going to apply for our apartment. I'm not handling it well. I moved to a new town and started a new life but nothing helps.,"I am so sorry to hear of your boyfriend's passing. Grief is something that can take a long time to recover from. Have you considered speaking with a grief counselor? Being able to speak with someone that specializes in grief would be very beneficial.Do not get down on yourself for not recovering quickly. This is one of the hardest aspects to deal with in life but eventually you will be able to move forward.In the mean time, immerse yourself with positivity (i.e. Good friends, hobbies, exercise) and try to s"
I did some horrible sexual things as a kid and I regret everything. Can someone help me cope with myself? Can someone help me remember my past?,"I'm very sorry to hear this. Hypnosis can be a valuable tool that a trained therapist can use to bring back suppressed memories. However, keep in mind that hypnosis doesn't work for everyone.I think regardless, speaking with a therapist about your sexual issues would be beneficial. It seems like you have experienced some painful experiences in the past and may need help dealing with them in order to move forward.In addition, if past memories do resurface a trained therapist will be able to help you cope wit"
"I have been with a guy for 4 years, he's a great guy and we also have a son together. The problem is that I'm in love with a guy that I've been talking to for about 2 years but I've never met him in person. Honestly I'm bored with the relationship I have w","Hi there. Wow, this sounds like a sticky situation; however, Im here to help guide you through this decision.First and foremost, you must ask yourself, if you ever loved your sons father or was it a situation to where you two got pregnant and stayed together for the child. Its very common to stay with your partner when a child is involved regardless, if love is involved or not because its the right thing to do. Right? Well, not entirely. Although, staying with your partner because you have a child together "
My boyfriend can't get over my promiscuous past. He says he loves me but says the thought of my past is disgusting and a sexual distraction. He says he should have had more sex with different people. I don't know how to handle this.,"I am sorry to hear of your relationship struggles.One thing I wonder is did you volunteer the information about your past or is this something that he asked about? In the future, it is probably best to leave details out of conversations like this. I think it is common and natural for partners to ask about the sexual history. For one thing, it is a good idea to be checked for STDs before entering into a sexual relationship with someone, and it is fair to share that information with each other. Partners usual"
What do I do if I have been feeling like I could never be with anyone because no one would want me. Or I couldn't have many friends because of who I am. It's strange I want to be loved but I'd hate to be because I always lose.,"I'm sorry you are feeling uncared for. I'm sure there are plenty of people that care and love for you that you are not taking into consideration. Sometimes when we get upset we may think irrationally and see the world as all or nothing. However, take a deep breath, relax and start focusing on the positive relationships you have with others, regardless of how small or insignificant they may seem. I think you will quickly realize there are people out there that care a great deal about you.I also think it woul"
"What makes my step child, an 8 year old boy, choke my daughter, a 6 year old girl? This has been going on for 4 years. The boy tells my daughter not to tell on him. He knows it's wrong; we have did time out, spanking, taking away toys, and sitting on the w","I can see why you are alarmed. That is a scary situation for a parent. Do you know if the child has been evaluated by a mental health professional? Early treatment is often the key. A professional will be able to help the child learn how to control their anger and mend the troublesome actions into more appropriate responses.Have you addressed your concerns with the child's other parent? There could be contributing factors in his life that could be causing these issues (exposure to violence, sexual/physical "
